{
  "repo": "midnightntwrk/midnight-examples",
  "commit": "4056c6cf773596bccc2a15fac32cc817d6143a39",
  "toolchain": {
    "Compact language (pragma)": "0.23",
    "Compact compiler (setup-compact-action)": "0.31.1",
    "@midnight-ntwrk/midnight-js-*": "4.1.1",
    "@midnight-ntwrk/testkit-js": "4.1.1",
    "wallet SDK": "1.2.0",
    "Node.js": "22",
    "Yarn": "4.18.0",
    "Vitest": "4.1.0"
  },
  "examples": [
    {
      "name": "hello-world",
      "path": "examples/hello-world",
      "summary": "The smallest working DApp: a contract that stores a message, its tests against a local network, and a browser UI",
      "topics": [
        "getting started",
        "first contract",
        "deploy a contract",
        "store state",
        "providers",
        "network config",
        "wallet sync"
      ],
      "url": "https://github.com/midnightntwrk/midnight-examples/tree/4056c6cf773596bccc2a15fac32cc817d6143a39/examples/hello-world",
      "files": [
        {
          "path": "examples/hello-world/contract/hello-world.compact",
          "symbol": "export circuit storeMessage",
          "about": "A circuit that writes a public ledger value",
          "lines": [
            5,
            7
          ],
          "url": "https://github.com/midnightntwrk/midnight-examples/blob/4056c6cf773596bccc2a15fac32cc817d6143a39/examples/hello-world/contract/hello-world.compact#L5-L7",
          "excerpt": "export circuit storeMessage(newMessage: Opaque<\"string\">): [] {\n  message = disclose(newMessage);\n}"
        },
        {
          "path": "examples/hello-world/src/test/hw.test.ts",
          "symbol": "it('Deploys the contract'",
          "about": "Deploying a contract with deployContract",
          "lines": [
            175,
            193
          ],
          "url": "https://github.com/midnightntwrk/midnight-examples/blob/4056c6cf773596bccc2a15fac32cc817d6143a39/examples/hello-world/src/test/hw.test.ts#L175-L193",
          "excerpt": "  it('Deploys the contract', async () => {\n    logger.info(`Creating private state...`);\n\n    const deployed: DeployedContract<Contract> =\n      await (deployContract<Contract>)(providers, {\n        compiledContract: CompiledHelloWorldContract,\n        privateStateId: PRIVATE_STATE_ID,\n        initialPrivateState: {},\n      });\n\n    logger.info(`Setting the contract address...`);\n    contractAddress = deployed.deployTxData.public.contractAddress;\n    logger.info(`Contract deployed at: ${contractAddress}`);\n    expect(contractAddress).toBeDefined();\n    expect(contractAddress.length).toBeGreaterThan(0);\n\n    const state = await queryLedger(providers);\n    expect(state.message).toEqual('');\n  });"
        },
        {
          "path": "examples/hello-world/src/providers.ts",
          "symbol": "export function buildProviders",
          "about": "Wiring up the midnight-js providers a contract needs",
          "lines": [
            13,
            38
          ],
          "url": "https://github.com/midnightntwrk/midnight-examples/blob/4056c6cf773596bccc2a15fac32cc817d6143a39/examples/hello-world/src/providers.ts#L13-L38",
          "excerpt": "export function buildProviders(\n    wallet: MidnightWalletProvider,\n    zkConfigPath: string,\n    config: NetworkConfig,\n): HelloWorldProviders {\n    const zkConfigProvider = new NodeZkConfigProvider<HelloWorldCircuits>(zkConfigPath);\n\n    return {\n        privateStateProvider: levelPrivateStateProvider({\n            privateStateStoreName: `hello-world-${Date.now()}`,\n            privateStoragePasswordProvider: () => 'Hello-World-Test-Password',\n            accountId: wallet.getCoinPublicKey(),\n        }),\n        publicDataProvider: indexerPublicDataProvider(\n            config.indexer,\n            config.indexerWS,\n        ),\n        zkConfigProvider,\n        proofProvider: httpClientProofProvider(\n            config.proofServer,\n            zkConfigProvider,\n        ),\n        walletProvider: wallet,\n        midnightProvider: wallet,\n  // …"
        },
        {
          "path": "examples/hello-world/src/config.ts",
          "symbol": "export function getConfig",
          "about": "Choosing the network's endpoints (local, preview, preprod)",
          "lines": [
            39,
            47
          ],
          "url": "https://github.com/midnightntwrk/midnight-examples/blob/4056c6cf773596bccc2a15fac32cc817d6143a39/examples/hello-world/src/config.ts#L39-L47",
          "excerpt": "export function getConfig(): NetworkConfig {\n  const network = process.env['MIDNIGHT_NETWORK'] ?? 'local';\n  if (network === 'local') return LOCAL_CONFIG;\n  if (network === 'preview') return PREVIEW_CONFIG;\n  if (network === 'preprod') return preprodConfig();\n  throw new Error(\n    `Unknown network: ${network}. Supported: 'local', 'preview', 'preprod'.`,\n  );\n}"
        },
        {
          "path": "examples/hello-world/src/wallet.ts",
          "symbol": "export async function syncWallet",
          "about": "Syncing a wallet and reporting its progress",
          "lines": [
            137,
            185
          ],
          "url": "https://github.com/midnightntwrk/midnight-examples/blob/4056c6cf773596bccc2a15fac32cc817d6143a39/examples/hello-world/src/wallet.ts#L137-L185",
          "excerpt": "export async function syncWallet(\n  logger: Logger,\n  wallet: WalletFacade,\n  timeout = 300_000,\n): Promise<FacadeState> {\n  logger.info('Syncing wallet...');\n  let emissionCount = 0;\n  return Rx.firstValueFrom(\n    wallet.state().pipe(\n      Rx.tap((state: FacadeState) => {\n        emissionCount++;\n        const shielded = isProgressStrictlyComplete(state.shielded.state.progress);\n        const unshielded = isProgressStrictlyComplete(state.unshielded.progress);\n        const dust = isProgressStrictlyComplete(state.dust.state.progress);\n        logger.info(\n          `Wallet sync [${emissionCount}]: shielded=${formatProgress(state.shielded.state.progress)}, ` +\n            `unshielded=${formatProgress(state.unshielded.progress)}, dust=${formatProgress(state.dust.state.progress)}`,\n        );\n        if (!shielded) {\n          logger.debug(`  shielded.progress: ${JSON.stringify(state.shielded.state.progress)}`);\n        }\n        if (!unshielded) {\n          logger.debug(`  unshielded.progress: ${JSON.stringify(state.unshielded.progress)}`);\n        }\n  // …"
        }
      ]
    },
    {
      "name": "calculator",
      "path": "examples/calculator",
      "summary": "A public ledger value, arithmetic circuits, and a witness that computes off-chain what the circuit only checks",
      "topics": [
        "witness",
        "arithmetic",
        "division",
        "public ledger",
        "uint",
        "off-chain computation"
      ],
      "url": "https://github.com/midnightntwrk/midnight-examples/tree/4056c6cf773596bccc2a15fac32cc817d6143a39/examples/calculator",
      "files": [
        {
          "path": "examples/calculator/contract/calculator.compact",
          "symbol": "witness divMod",
          "about": "A witness declared in Compact, computed in TypeScript",
          "lines": [
            22,
            22
          ],
          "url": "https://github.com/midnightntwrk/midnight-examples/blob/4056c6cf773596bccc2a15fac32cc817d6143a39/examples/calculator/contract/calculator.compact#L22-L22",
          "excerpt": "witness divMod(num1: Uint<16>, num2: Uint<16>): [Uint<16>, Uint<16>];"
        },
        {
          "path": "examples/calculator/contract/calculator.compact",
          "symbol": "export circuit divide",
          "about": "Checking a witness's answer inside the circuit",
          "lines": [
            25,
            33
          ],
          "url": "https://github.com/midnightntwrk/midnight-examples/blob/4056c6cf773596bccc2a15fac32cc817d6143a39/examples/calculator/contract/calculator.compact#L25-L33",
          "excerpt": "export circuit divide(num1: Uint<16>, num2: Uint<16>): [] {\n    const [quo, rem] = divMod(num1, num2);\n    assert(rem < num2 && quo * num2 + rem == num1, \"incorrect division\");\n    // `quo` comes from the divMod witness; storing it in the public ledger is a\n    // disclosure that must be declared explicitly. Writing state (rather than\n    // just returning) makes this a proof-generating, on-chain circuit like the\n    // other operations.\n    result = disclose(quo);\n}"
        }
      ]
    },
    {
      "name": "private-party",
      "path": "examples/private-party",
      "summary": "Private on-chain data, access control, and DUST sponsorship: one wallet pays the fees for another's transaction",
      "topics": [
        "dust sponsorship",
        "sponsor fees",
        "pay fees for another user",
        "access control",
        "commitment",
        "hashed set membership",
        "private guest list"
      ],
      "url": "https://github.com/midnightntwrk/midnight-examples/tree/4056c6cf773596bccc2a15fac32cc817d6143a39/examples/private-party",
      "files": [
        {
          "path": "examples/private-party/src/sponsor.ts",
          "symbol": "export async function sponsorAndSubmit",
          "about": "Having a sponsor wallet pay the DUST fee and submit",
          "lines": [
            96,
            115
          ],
          "url": "https://github.com/midnightntwrk/midnight-examples/blob/4056c6cf773596bccc2a15fac32cc817d6143a39/examples/private-party/src/sponsor.ts#L96-L115",